{
  "symbol": "BYDDF",
  "analysis": "\n        goal = Conduct a concise financial analysis of {ticker} based on recent market trends, historical data, and technical indicators.\n\n        Return Format:\n            - Summary: A brief overview of the stock’s current trend.\n            - Key Financial Indicators: Price movements, moving averages (SMA/EMA).\n            - Market Sentiment: A summary of recent news and sentiment trends.\n            - Risk Factors: Highlight any volatility, earnings reports, or macroeconomic risks.\n\n        Warnings:\n            - Do not provide direct financial advice.\n            - Ensure the response is fact-based and avoids speculation.\n            - Keep the response concise, focusing on actionable insights without exceeding 2000 words.\n\n        Context:\n            - Stock Data: {stock_data}\n            - Technical Indicators: Provide insights based on available technical data.\n            - Sentiment Analysis: Summarize the sentiment around recent news articles.\n            - Macroeconomic Trends: Highlight broader economic influences impacting this stock.\n    Metadata: {'ticker': 'BYDDF', 'industry': 'N/A', 'market_cap': 'N/A', 'dividend_yield': 'N/A', 'pe_ratio': 'N/A', 'eps': 'N/A', 'beta': 'N/A', '52_week_high': 'N/A', '52_week_low': 'N/A', 'current_price': 'N/A', 'analyst_ratings': 'N/A', 'price_targets': 'N/A', 'events': 'N/A', 'about_BYDDF': 'N/A', 'last_updated': datetime.datetime(2025, 4, 6, 18, 47, 22, 751943)}\nHistorical Data: {'ticker': 'BYDDF', 'historical_data': [{'date': '2025-04-04', 'open': '50.7000', 'high': '51.1600', 'low': '43.1200', 'close': '44.3300', 'adjusted_close': '44.3300', 'volume': '1047566', 'dividend_amount': '0.0000'}, {'date': '2025-03-28', 'open': '54.6000', 'high': '54.6000', 'low': '50.5000', 'close': '51.8200', 'adjusted_close': '51.8200', 'volume': '1496084', 'dividend_amount': '0.0000'}, {'date': '2025-03-21', 'open': '50.8700', 'high': '54.5500', 'low': '49.2500', 'close': '50.8920', 'adjusted_close': '50.8920', 'volume': '1672863', 'dividend_amount': '0.0000'}, {'date': '2025-03-14', 'open': '44.8300', 'high': '50.3200', 'low': '43.3100', 'close': '50.1000', 'adjusted_close': '50.1000', 'volume': '578203', 'dividend_amount': '0.0000'}, {'date': '2025-03-07', 'open': '48.5000', 'high': '49.1000', 'low': '40.1000', 'close': '45.0900', 'adjusted_close': '45.0900', 'volume': '840369', 'dividend_amount': '0.0000'}], 'last_updated': datetime.datetime(2025, 4, 6, 18, 47, 23, 554904)}\nIncome Statement: {'ticker': 'BYDDF', 'annual_reports': []}\nBalance Sheet: {'ticker': 'BYDDF', 'annual_reports': []}\nCash Flow: {'ticker': 'BYDDF', 'annual_reports': []}\nEarnings: {'ticker': 'BYDDF', 'annual_reports': []}\nSMA: {'2025-04-04': {'SMA': '33.1084'}, '2025-03-28': {'SMA': '32.7558'}, '2025-03-21': {'SMA': '32.2552'}, '2025-03-14': {'SMA': '31.8123'}, '2025-03-07': {'SMA': '31.3935'}, '2025-02-28': {'SMA': '31.0853'}, '2025-02-21': {'SMA': '30.7253'}, '2025-02-14': {'SMA': '30.3401'}, '2025-02-07': {'SMA': '29.9967'}, '2025-01-31': {'SMA': '29.7260'}, '2025-01-24': {'SMA': '29.5848'}, '2025-01-17': {'SMA': '29.4332'}}\nEMA: {'2025-04-04': {'EMA': '35.7020'}, '2025-03-28': {'EMA': '35.4095'}, '2025-03-21': {'EMA': '34.8533'}, '2025-03-14': {'EMA': '34.3096'}, '2025-03-07': {'EMA': '33.7743'}, '2025-02-28': {'EMA': '33.3907'}, '2025-02-21': {'EMA': '32.8972'}, '2025-02-14': {'EMA': '32.3043'}, '2025-02-07': {'EMA': '31.8173'}, '2025-01-31': {'EMA': '31.4688'}, '2025-01-24': {'EMA': '31.3484'}, '2025-01-17': {'EMA': '31.2173'}}\nNews: [{'article': 1, 'title': 'Global Electric Vehicle Market Records 31% Sales Boom In 2023: Report - Tesla  ( NASDAQ:TSLA ) ', 'summary': 'In a recent report by market research firm Rho Motion, global electric vehicle ( EV ) sales experienced a significant increase of 31% in 2023 despite a slowdown in growth.', 'pubDate': '20240111T082853', 'url': 'https://www.benzinga.com/news/24/01/36589115/global-electric-vehicle-market-records-31-sales-boom-in-2023-report', 'thumbnail': 'https://cdn.benzinga.com/files/images/story/2024/An-electric-car-based-on-Volkswagens-MEB.jpeg?width=1200&height=800&fit=crop', 'sentimentScore': 0.230325, 'sentimentLabel': 'Somewhat-Bullish'}, {'article': 2, 'title': 'EV Price Wars: Hyundai And Kia Slash EV Prices Amidst South Korean Subsidy Surge: Report - BYD  ( OTC:BYDDY ) , Hyundai Motor  ( OTC:HYMTF ) ', 'summary': \"Hyundai Motor Co HYMTF and Kia Corp reportedly plan to decrease the prices of several electric vehicles ( EVs ) . This move comes in light of the South Korean government's decision to expand subsidies as it aims to revive the dwindling interest and demand for clean vehicles in the country, ...\", 'pubDate': '20230926T113903', 'url': 'https://www.benzinga.com/markets/equities/23/09/34896096/ev-price-wars-hyundai-and-kia-slash-ev-prices-amidst-south-korean-subsidy-surge-report', 'thumbnail': 'https://cdn.benzinga.com/files/images/story/2023/09/26/hyundai.png?width=1200&height=800&fit=crop', 'sentimentScore': 0.05231, 'sentimentLabel': 'Neutral'}, {'article': 3, 'title': \"China's Jan-Feb passenger cars sales down 20% - CPCA\", 'summary': \"China's Jan-Feb passenger cars sales down ...\", 'pubDate': '20230308T091800', 'url': 'https://www.reuters.com/business/autos-transportation/chinas-jan-feb-passenger-cars-sales-down-20-cpca-2023-03-08/', 'thumbnail': 'https://cloudfront-us-east-2.images.arcpublishing.com/reuters/7B3NNVF4NVIBRITTD7LWW6RWVA.jpg', 'sentimentScore': 0.04799, 'sentimentLabel': 'Neutral'}]\n\nThis is a preliminary Artificail Intelligence (AI) analysis. Please consult a financial advisor for investment decisions.",
  "llm_response": "Okay, here's a breakdown of the provided data, focusing on key insights and potential implications for the stock (OTC:BYDDY - BYD) based on this analysis:\n\n**1. Stock Overview (BYDDY - BYD):**\n\n*   **Ticker:** BYDDY (OTC - meaning it's traded over-the-counter, which can indicate higher risk and less liquidity)\n*   **Focus:** The analysis is centered around BYD, a Chinese electric vehicle (EV) manufacturer.\n\n**2. Key AI Analysis Findings:**\n\n*   **Positive Sentiment (Mixed):**\n    *   **Article 1 (Benzinga):**  \"Global Electric Vehicle Market Records 31% Sales Boom In 2023\" - Sentiment Score: 0.230325 (Somewhat-Bullish). This is the strongest positive signal. The overall EV market is booming, which is a significant tailwind for BYD.\n    *   **Article 2 (Benzinga):** \"EV Price Wars: Hyundai And Kia Slash EV Prices Amidst South Korean Subsidy Surge\" - Sentiment Score: 0.05231 (Neutral).  This is a more complex signal. While BYD is competing in a price war, the underlying trend of government subsidies driving EV demand is still present.\n*   **Neutral Sentiment:**\n    *   **Article 3 (Reuters):** \"China's Jan-Feb passenger cars sales down 20% - CPCA\" - Sentiment Score: 0.04799 (Neutral). This is a negative signal – a 20% decline in Chinese passenger car sales is concerning. It suggests potential headwinds for BYD, as China is its largest market.\n\n**3.  Interpretation & Potential Implications:**\n\n*   **Overall, the analysis leans slightly bullish, but with significant caveats.** The global EV market growth is a major positive.\n*   **Competition is a Key Risk:** The \"EV Price Wars\" (Article 2) highlight intense competition, particularly from Hyundai and Kia.  BYD needs to maintain its cost advantage to succeed.\n*   **China Market Headwinds:** The declining Chinese sales (Article 3) are a serious concern.  Understanding the *reasons* for this decline is crucial (e.g., economic slowdown, changing consumer preferences, regulatory changes).\n*   **OTC Stock Considerations:** Trading OTC stocks like BYDDY carries higher risk due to lower liquidity and potentially less stringent regulatory oversight.\n\n**4.  Recommendations (Based *solely* on this AI analysis - *not* investment advice):**\n\n*   **Further Research is Critical:** This AI analysis is a starting point.  You *must* conduct thorough due diligence.\n    *   **Understand BYD's Financials:**  Analyze BYD's revenue, profitability, debt levels, and cash flow.\n    *   **Monitor the Chinese Market:** Closely track sales trends, government policies, and economic conditions in China.\n    *   **Assess Competitive Landscape:**  Continuously evaluate BYD's position relative to its competitors (Tesla, Volkswagen, etc.).\n*   **Risk Tolerance:**  Given the OTC nature of BYDDY, only invest an amount you can afford to lose.\n\n**Disclaimer:** *I am an AI Chatbot and cannot provide financial advice. This analysis is based solely on the provided data and does not constitute investment recommendations. Consult with a qualified financial advisor before making any investment decisions.*\n\nTo help me refine this analysis further, could you tell me:\n\n*   What specific aspects of BYD's business are you most interested in (e.g., its technology, its market share, its financial performance)?\n*   Are there any particular news sources or data points you'd like me to prioritize?",
  "deepthinking_response": "<think>\nOkay, so I need to help refine the analysis for the stock OTC:BYDDY - BYD. Let's start by going through all the provided information and see what we can do to make it more detailed and actionable.\n\nFirst, from the initial breakdown, the key points are:\n\n- **Ticker:** BYDDY\n- **Focus:** Electric Vehicle (EV) manufacturer in China\n\nThe AI analysis mentions a few articles with sentiment scores. The most positive is from Benzinga about global EV market growth, which is somewhat bullish. Then there's a neutral sentiment about price wars and another negative about declining Chinese sales.\n\nI think the user wants more detailed insights beyond just the initial analysis. So maybe I can structure this into sections like company overview, financials, market performance, risks, etc., to make it more comprehensive.\n\nLooking at the first section, \"Stock Overview,\" it's pretty brief. It mentions BYDDY is OTC and a Chinese EV maker but doesn't go deeper. Maybe adding details about BYD's position in the EV industry could help, like their main products or partnerships.\n\nNext, under \"Key AI Analysis Findings,\" we have positive, neutral, and negative sentiments with explanations. Perhaps expanding on each sentiment point would provide more clarity. For example, explaining why global EV market growth is a good thing for BYD—maybe mentioning how that affects demand in China as well since it's their largest market.\n\nThe \"Interpretation & Potential Implications\" section could use some expansion. Maybe linking the global growth to BYD's performance and how despite the positive sentiment, the negative factors like declining Chinese sales might offset some gains.\n\nIn the recommendations part, the user is advised further research but maybe adding specific steps they can take would be helpful. For example, suggesting looking into financials more deeply or monitoring M&A activities if BYD has any in this space.\n\nConsidering the structure, I think a clear outline with headings like Company Overview, Market Position, Financial Performance, Key Risks, and Actionable Insights would make it organized and easy to follow.\n\nI also need to address any missing data points. For instance, revenue growth or debt levels weren't mentioned. If that data is available, including it could strengthen the analysis.\n\nAdditionally, incorporating news sources' insights more deeply could provide context on why certain events are relevant. Maybe looking into recent market-moving news about BYD would add more weight to the analysis.\n\nLastly, since BYDDY is OTC, highlighting potential risks related to liquidity and regulatory changes in the over-the-counter market should be emphasized.\n\nSo putting it all together, I'll structure the report with these sections, adding detailed bullet points under each, and make sure to reference the provided data accurately while suggesting areas for further research.\n</think>\n\n**Deep Analysis of BYDDY (OTC Stock)**\n\n---\n\n### **1. Company Overview**\n- **BYD Group**: BYDDY stands for Benzinga, a Chinese electric vehicle manufacturer based in Shenzhen.\n- **Market Position**: A leading EV maker with a strong presence in the EV industry, particularly in China and globally through partnerships like BYD Group HOLDCo.\n\n---\n\n### **2. Market Position**\n- **Global EV Market Growth**: The global EV market's 31% year-on-year growth is a significant tailwind for BYD.\n- **China's Dominance**: As China's largest EV market, declines in passenger car sales by 20% are concerning, potentially affecting BYD's primary revenue source.\n\n---\n\n### **3. Financial Performance**\n- **Revenue Growth**: Mention specific growth figures or percentage increases to highlight financial health.\n- **Profitability**: Include net income and profit margins to assess profitability trends.\n- **Debt Levels**: Highlight any debt metrics if available; high debt could be a risk indicator.\n\n---\n\n### **4. Key Risks**\n- **China Market Headwinds**: Investigate the reasons behind declining sales, such as economic slowdown or competition from domestic EV players.\n- **Competition**: Assess BYD's position relative to global and Chinese competitors like Tesla and Volkswagen.\n- **Liquidity Constraints**: Emphasize OTC risks, including lower liquidity compared to exchanges like NASDAQ.\n\n---\n\n### **5. Actionable Insights**\n1. **Financial Health Review**: Analyze recent financial reports for revenue growth and profitability trends.\n2. **Market Monitoring**: Track industry developments, M&A activities, and strategic investments in EV tech.\n3. **Liquidity Assessment**: Consider the impact of OTC market volatility on investment stability.\n\n---\n\n### **6. Conclusion**\n- **Summary of Findings**: Highlight BYD's strengths in global EV growth and potential vulnerabilities from China's market challenges.\n- **Investment Suitability**: Provide a balanced view, considering BYD's growth opportunities and risks.\n\n---\n\nThis structured approach provides a comprehensive analysis, emphasizing key areas for further research to inform investment decisions.",
  "stock_data": {
    "metadata": {
      "ticker": "BYDDF",
      "industry": "N/A",
      "market_cap": "N/A",
      "dividend_yield": "N/A",
      "pe_ratio": "N/A",
      "eps": "N/A",
      "beta": "N/A",
      "52_week_high": "N/A",
      "52_week_low": "N/A",
      "current_price": "N/A",
      "analyst_ratings": "N/A",
      "price_targets": "N/A",
      "events": "N/A",
      "about_BYDDF": "N/A",
      "last_updated": "2025-04-06T18:47:22.751943"
    },
    "historical_data": {
      "ticker": "BYDDF",
      "historical_data": [
        {
          "date": "2025-04-04",
          "open": "50.7000",
          "high": "51.1600",
          "low": "43.1200",
          "close": "44.3300",
          "adjusted_close": "44.3300",
          "volume": "1047566",
          "dividend_amount": "0.0000"
        },
        {
          "date": "2025-03-28",
          "open": "54.6000",
          "high": "54.6000",
          "low": "50.5000",
          "close": "51.8200",
          "adjusted_close": "51.8200",
          "volume": "1496084",
          "dividend_amount": "0.0000"
        },
        {
          "date": "2025-03-21",
          "open": "50.8700",
          "high": "54.5500",
          "low": "49.2500",
          "close": "50.8920",
          "adjusted_close": "50.8920",
          "volume": "1672863",
          "dividend_amount": "0.0000"
        },
        {
          "date": "2025-03-14",
          "open": "44.8300",
          "high": "50.3200",
          "low": "43.3100",
          "close": "50.1000",
          "adjusted_close": "50.1000",
          "volume": "578203",
          "dividend_amount": "0.0000"
        },
        {
          "date": "2025-03-07",
          "open": "48.5000",
          "high": "49.1000",
          "low": "40.1000",
          "close": "45.0900",
          "adjusted_close": "45.0900",
          "volume": "840369",
          "dividend_amount": "0.0000"
        }
      ],
      "last_updated": "2025-04-06T18:47:23.554904"
    },
    "news": [
      {
        "article": 1,
        "title": "Global Electric Vehicle Market Records 31% Sales Boom In 2023: Report - Tesla  ( NASDAQ:TSLA ) ",
        "summary": "In a recent report by market research firm Rho Motion, global electric vehicle ( EV ) sales experienced a significant increase of 31% in 2023 despite a slowdown in growth.",
        "pubDate": "20240111T082853",
        "url": "https://www.benzinga.com/news/24/01/36589115/global-electric-vehicle-market-records-31-sales-boom-in-2023-report",
        "thumbnail": "https://cdn.benzinga.com/files/images/story/2024/An-electric-car-based-on-Volkswagens-MEB.jpeg?width=1200&height=800&fit=crop",
        "sentimentScore": 0.230325,
        "sentimentLabel": "Somewhat-Bullish"
      },
      {
        "article": 2,
        "title": "EV Price Wars: Hyundai And Kia Slash EV Prices Amidst South Korean Subsidy Surge: Report - BYD  ( OTC:BYDDY ) , Hyundai Motor  ( OTC:HYMTF ) ",
        "summary": "Hyundai Motor Co HYMTF and Kia Corp reportedly plan to decrease the prices of several electric vehicles ( EVs ) . This move comes in light of the South Korean government's decision to expand subsidies as it aims to revive the dwindling interest and demand for clean vehicles in the country, ...",
        "pubDate": "20230926T113903",
        "url": "https://www.benzinga.com/markets/equities/23/09/34896096/ev-price-wars-hyundai-and-kia-slash-ev-prices-amidst-south-korean-subsidy-surge-report",
        "thumbnail": "https://cdn.benzinga.com/files/images/story/2023/09/26/hyundai.png?width=1200&height=800&fit=crop",
        "sentimentScore": 0.05231,
        "sentimentLabel": "Neutral"
      },
      {
        "article": 3,
        "title": "China's Jan-Feb passenger cars sales down 20% - CPCA",
        "summary": "China's Jan-Feb passenger cars sales down ...",
        "pubDate": "20230308T091800",
        "url": "https://www.reuters.com/business/autos-transportation/chinas-jan-feb-passenger-cars-sales-down-20-cpca-2023-03-08/",
        "thumbnail": "https://cloudfront-us-east-2.images.arcpublishing.com/reuters/7B3NNVF4NVIBRITTD7LWW6RWVA.jpg",
        "sentimentScore": 0.04799,
        "sentimentLabel": "Neutral"
      }
    ],
    "income_statement": {
      "ticker": "BYDDF",
      "annual_reports": []
    },
    "balance_sheet": {
      "ticker": "BYDDF",
      "annual_reports": []
    },
    "cash_flow": {
      "ticker": "BYDDF",
      "annual_reports": []
    },
    "earnings": {
      "ticker": "BYDDF",
      "annual_reports": []
    },
    "sma": {
      "2025-04-04": {
        "SMA": "33.1084"
      },
      "2025-03-28": {
        "SMA": "32.7558"
      },
      "2025-03-21": {
        "SMA": "32.2552"
      },
      "2025-03-14": {
        "SMA": "31.8123"
      },
      "2025-03-07": {
        "SMA": "31.3935"
      },
      "2025-02-28": {
        "SMA": "31.0853"
      },
      "2025-02-21": {
        "SMA": "30.7253"
      },
      "2025-02-14": {
        "SMA": "30.3401"
      },
      "2025-02-07": {
        "SMA": "29.9967"
      },
      "2025-01-31": {
        "SMA": "29.7260"
      },
      "2025-01-24": {
        "SMA": "29.5848"
      },
      "2025-01-17": {
        "SMA": "29.4332"
      }
    },
    "ema": {
      "2025-04-04": {
        "EMA": "35.7020"
      },
      "2025-03-28": {
        "EMA": "35.4095"
      },
      "2025-03-21": {
        "EMA": "34.8533"
      },
      "2025-03-14": {
        "EMA": "34.3096"
      },
      "2025-03-07": {
        "EMA": "33.7743"
      },
      "2025-02-28": {
        "EMA": "33.3907"
      },
      "2025-02-21": {
        "EMA": "32.8972"
      },
      "2025-02-14": {
        "EMA": "32.3043"
      },
      "2025-02-07": {
        "EMA": "31.8173"
      },
      "2025-01-31": {
        "EMA": "31.4688"
      },
      "2025-01-24": {
        "EMA": "31.3484"
      },
      "2025-01-17": {
        "EMA": "31.2173"
      }
    }
  }
}